ID;Title;Description;Category;Price;Status
1;Drużyna Pierścienia;Drużyna Pierścienia to pierwsza część trylogii J.R.R. Tolkiena, w której poznajemy naszych bohaterów i dowiadujemy się, co sprawia, że opuszczają swoje domy i wyruszają w niebezpieczną misję zniszczenia Jedynego Pierścienia, poszukiwanego przez jego prawowitego właściciela, władcę Mordoru - Saurona.;Fantasy;30;1
2;Metro 2035;Spaniała książka, polecam gorąco - Krzysztof Hołowczyc;Postapokalipsa;10;1
3;Chrzest ognia;Powieść z gatunku fantasy, napisana przez Andrzeja Sapkowskiego, wydana w 1996. Jest trzecią z pięciu części tzw. sagi o wiedźminie.;Fantasy;0;0
4;Harry Potter i Kamień Filozoficzny;A co, jeśli świat magii i czarów istnieje naprawdę? Jest tuż obok nas? Wkrocz wraz z młodym czarodziejem, Harrym Potterem, do niezwykłej, alternatywnej rzeczywistości, gdzie wszystko jest możliwe.;Fantasy;14,99;1
5;Z pierwszej piłki;Nim doszło do tragedii, Rewera Opole została okrzyknięta największym fenomenem polskiego futbolu. W efektowny sposób awansowała do najwyższej klasy rozgrywkowej, a potem rozbijała rywali jednego po drugim.;Kryminał;7;1
6;Diddly Squat. Rok na farmie;Witajcie na farmie Clarksona, w idyllicznym miejscu pełnym malowniczych widoków, tętniących życiem lasów i wartkich strumieni!;Literatura faktu;18,50;1
